Name,Email,Phone,Company,Job Title,Country,Notes
Paul Pruitt,jason70@example.net,784-939-1387x7122,"Lynch, Fuller and Levy",Higher education careers adviser,Luxembourg,Next three end thing able scientist less blue especially.
Donna Hayes,wrightjeff@example.com,,"Arnold, Perry and Davis",Public librarian,Kenya,Outside recent though enter street guess ground behavior some dog dinner study school indicate great help.
Meghan Cook,danielmccullough@example.org,001-707-896-3321x7106,Singh-Odonnell,Contracting civil engineer,Korea,Partner develop particularly professional purpose during life rich.
Randy Price,imartinez@example.com,001-280-497-1734x683,"Jackson, Garcia and Robinson",Optometrist,Portugal,Police maybe heart hear ground weight morning identify staff argue soon.
Ryan Colon,robertmason@example.net,001-411-853-2850,Schroeder-Castillo,Holiday representative,Bahamas,Myself leader worry nothing only analysis argue include my leg.
Edward Butler,mnguyen@example.com,392.336.7721,Hodge Inc,"Geologist, engineering",Congo,Operation peace knowledge event green hot difference science.
Amanda Kim,gina72@example.net,(651)697-0147x96324,Perez PLC,Media buyer,Switzerland,Newspaper parent spend employee collection each message first condition difference chair.
Patricia Horton,kmaloneexample.net,806-908-4463x79980,"Obrien, Cobb and Rogers",Immigration officer,Fiji,However fund inside show sense government actually own standard just usually bar center lose statement.
Rebecca Ramirez,hruiz@example.net,931.912.4060x237,Fowler Ltd,Music tutor,Guernsey,Summer cup ten daughter specific always about treat ask form full indeed task marriage white news.
Micheal Torres,phillip36@example.net,330-816-3270x4611,Irwin and Sons,Private music teacher,North Macedonia,Case space must interest determine effect once because senior father determine business.
Jessica Robinson,patricia68@example.org,,"Walker, Ferrell and Rangel",Merchant navy officer,Korea,Able radio book coach difficult than believe its.
Elizabeth Wood,zanderson@example.org,+1-351-495-5469x6068,Wright Inc,Pathologist,Jordan,Join return above call goal tell actually go kind prove join late.
Jean Erickson,jared30@example.org,374-627-8880x54905,"Castillo, Dennis and Fitzgerald",Education administrator,Tonga,Try suffer star whether especially eight participant.
Matthew Little,karenwalton@example.net,882-394-0909x6356,Harris-Smith,"Engineer, maintenance",Netherlands Antilles,Agent son safe school much high back light federal door than network each argue.
Stephen Cruz,donaldpham@example.net,+1-615-314-3831x80698,Berry-Green,Government social research officer,Saint Vincent and the Grenadines,Reach line throughout beyond space bring security travel suggest training production sister impact.
Christian King,stacygreen@example.org,+1-887-836-7898x3244,"Decker, Lyons and Burke",Airline pilot,Yemen,Thing dark measure manage quickly size leader.
James Rogers,paulabolton@example.net,9823096070,Horton-Cummings,Dealer,Martinique,Beat property later program room cover identify.
Brandon White,allisoncross@example.net,,Marks-Cannon,Risk manager,Poland,Federal everybody strong society like shoulder seat body wrong college lawyer range cold.
Paul Allen,hillmichaelexample.org,,Frank-Hubbard,Warehouse manager,Argentina,Recently perform require away remain receive enter Mr size peace world win drop politics agree.
Richard Hardin,angela45@example.org,896.962.3693x9759,White LLC,Physiotherapist,San Marino,Machine range anything black table strong into yard young speech store space including drop international arm.
Nina Mason,qnelson@example.org,312.996.3968x4902,Thompson-Robinson,"Editor, commissioning",Taiwan,Your prevent agree foreign responsibility floor south figure.
john fry,michelegrimes@example.org,807.222.5890x14821,"Johnson, Dixon and Hernandez",Physiological scientist,Bangladesh,Local mention subject myself fish go fast.
Alexis Taylor,tmcclure@example.org,(385)575-6081,Collins Ltd,Communications engineer,Heard Island and McDonald Islands,Space day either heavy evidence exactly keep attack future hour reality exist management floor voice.
Michael Fernandez,anthonysimon@example.net,+1-401-382-6803x2479,Mason Ltd,"Therapist, art",Timor-Leste,Drug hundred trade rise security Mrs this tell stop remember number character between join model until.
Yvette Martinez,jennynguyen@example.net,,"King, Tyler and George",Air cabin crew,Saint Martin,Pattern debate level let whether woman try contain trade.
Samantha Turner,ggray@example.com,(407)244-5036,Padilla-Reese,Aid worker,Uzbekistan,Remain conference class partner figure fall board business walk their single ground remain.
Heather Schneider,whopkins@example.net,(330)626-2404,Jensen LLC,Historic buildings inspector/conservation officer,Somalia,Tax recognize look fear lay government very memory.
Eric Nichols,audrey40@example.org,001-209-595-4072x2495,"Mays, Williams and Tate","Engineer, energy",Bulgaria,Their agree example next sister help box sound tax size own may public.
Marvin Chaney,george39@example.com,+1-687-496-3640,Beck Ltd,"Sound technician, broadcasting/film/video",Suriname,Commercial choice live court every research forward phone network evening.
Kristine Hurley,matthew80@example.net,8266748807,"Wyatt, Wilcox and Nichols",Immigration officer,Tuvalu,Experience return base they investment bring once history forward pressure fast explain win thank who.
John Jordan,schroederbonnie@example.com,001-222-524-8467x34799,Edwards Inc,Local government officer,Nepal,Possible senior enjoy possible watch fill less yard memory discover she manager air war protect.
David Spencer,tina31@example.net,001-592-345-1735x720,Gray Inc,Theatre stage manager,Guinea,Walk report court just any respond phone.
Courtney Estrada,sharon79@example.net,+1-369-981-1486x8604,Marshall-Chen,Intelligence analyst,Greenland,Cup decide both right food great forget toward mouth especially agency support not watch spring.
Stephen Evans,davischristopher@example.com,552-769-8160x68998,"Mosley, Chambers and Henderson",Animal technologist,Equatorial Guinea,Offer month hear exist then fill history hear sound.
Stephanie Watkins,jenkinsjeffrey@example.org,410.616.7881x995,"Brown, Richards and Garcia","Research officer, political party",Honduras,Partner window election spend degree quite employee all against pattern kitchen specific would.
Janet Rodriguez,carol49@example.org,+1-618-608-4929,"Berg, Hunt and Austin",Tourism officer,Saint Martin,Subject class wide nice customer account west certain finish ten left any ability task light.
Regina Roach,smithashley@example.net,001-740-673-6153x59571,Kennedy-Fisher,Medical illustrator,Ireland,Necessary small difference shake question ready environment defense hand.
Rachael James,alan92@example.com,001-355-681-7679x84291,"Jordan, Russell and Horne",Futures trader,Latvia,Red Mrs become place we perhaps sister magazine.
Kevin Landry,amandasmith@example.net,632.430.9202x32623,Myers-Gibson,"Engineer, civil (consulting)",Spain,Hair dog face suggest cover once practice debate morning few major as sound where.
Charles Shea,cranejohnexample.net,679.533.1149,Hayes-Key,Retail buyer,Cambodia,Education season trade than simple however kid.
Alexander Walsh,hancockvirginia@example.org,(642)560-1454x3987,"Rice, Nicholson and Thomas",Midwife,Georgia,Simply church language worry think far time none since help.
John Kent,fmontgomery@example.net,001-954-664-5368,Cameron and Sons,Physiotherapist,French Southern Territories,Door garden miss myself trouble eat our social son read continue.
Nicholas Jenkins,mmccartyexample.net,922-510-1485x5327,"Richards, Bennett and Lopez",Manufacturing engineer,Poland,Music determine bank positive minute level clearly lawyer occur smile expect.
George Mata,nbrown@example.net,9975902286,Wilcox Group,Clinical cytogeneticist,Netherlands,In sing religious machine sing blue man question direction.
Angela Harris,tammycook@example.net,722-397-6159x672,Adkins-Dunlap,"Therapist, speech and language",Bangladesh,Speak past wall key protect newspaper her from.
Jerome Hall,marcusbennett@example.com,609-692-9989,Hawkins Ltd,Catering manager,Wallis and Futuna,Night get at win small rather soon enter source blood however evidence.
Cynthia Gonzalez,polson@example.org,(427)455-0427x2413,"Morgan, Adams and Rosales","Engineer, maintenance (IT)",French Polynesia,Positive laugh sell item whole threat eight ground above free hard but peace.
Kayla Robertson,alvaradoronald@example.net,+1-708-608-6175x66968,Barnes-Johnson,Garment/textile technologist,Cambodia,Decide tell man else person let vote official turn top.
Damon Harris,lauraknight@example.org,(580)401-9217,"Horton, Mitchell and Cardenas","Psychotherapist, dance movement",Monaco,Four society garden move contain heavy level.
Megan Blankenship,lambtimothy@example.com,937.463.2564,Frazier Ltd,Lobbyist,Swaziland,Use year early develop analysis billion per.
Katrina Moran,david43@example.org,498-281-9073,Davis Ltd,Theatre director,Aruba,Go town education successful evidence major miss eat reason small subject.
Andrew Barker,schmidtrobert@example.org,+1-732-224-8959x249,Harrison Ltd,Furniture designer,Cape Verde,Human image good each eight together laugh mean decision.
Stephen White,tom68@example.com,001-889-269-7501x170,Evans Inc,"Designer, fashion/clothing",Switzerland,Get many plant fine road society wide successful beyond.
William Medina,fischerkathleen@example.com,001-955-991-1514,"Shaw, Jones and Roberson",Plant breeder/geneticist,Monaco,Past street southern individual focus plan drive church important I value newspaper.
Sarah Sheppard,ccrawford@example.org,001-909-360-9477,Woodward Ltd,"Doctor, hospital",Panama,Television would try section fight wear former sort woman parent.
Christopher Bright,frederickcollins@example.net,413-312-2792,"Alvarez, Fernandez and Gonzalez","Librarian, public",Sweden,Vote build religious free anything between serious social or recent under wait sound.
James Garcia,msanchez@example.com,(863)418-3549x1804,"Ellis, Young and Torres",Heritage manager,Italy,Relate fly home behavior a different character stock level foreign generation information.
Ashley Parker DVM,james51@example.org,+1-601-841-5301x331,Gamble-Pena,Radiation protection practitioner,Mexico,Concern success decision attorney effort parent environmental at rest little whole sing.
Joseph Bailey,oneilljudith@example.org,001-434-683-4509,Ford-Sanford,Artist,Mauritania,Media receive since interesting allow hear test.
Joshua White Jr.,brownsamuel@example.org,6716599128,Sanchez PLC,Chartered certified accountant,Uzbekistan,Opportunity per fire test training do quality country often woman cold size agent.
Patricia Garcia,griffithrobert@example.org,+1-746-910-9762x1735,Burns-Lopez,Risk analyst,Yemen,Strategy current line with or road attention.
Denise Davila,forderik@example.com,+1-468-753-2772,"Mccoy, Williams and Boyd",International aid/development worker,Guyana,Letter letter foot skill chance any great.
Debbie Johnson,theresagraham@example.com,919-628-6609x5940,Yates Inc,Orthoptist,Bermuda,After economic school hand fish work off station able.
Jacqueline Greene,vbailey@example.com,+1-366-476-5245,"Simmons, Mendoza and Jones",Air broker,Estonia,Suffer true before series sign white financial report nearly see commercial show.
George Gonzales,alexanderfernandez@example.org,,"Macias, Sanders and James",Geochemist,Nauru,Attorney power table information break listen before consumer perform protect like knowledge.
kristen hernandez,mariah26@example.net,001-655-962-4886x338,Crosby PLC,"Secretary, company",Poland,Learn military government nothing arrive conference now benefit day name chance west new cold bank will.
Kimberly Massey,samueljackson@example.com,+1-243-497-4093,Davis-Bell,Chartered management accountant,Martinique,Join name level wife just old theory eat project left social set.
Tina James,kendrarodriguez@example.net,426.894.8234x237,Collins Inc,"Horticulturist, amenity",Monaco,Fund manager sense someone door memory word.
Annette Flores,nicholas00@example.org,,"Barnett, Mosley and Torres",Health service manager,Christmas Island,Fall current choose story value part anything how room.
Nicholas Orozco,vickicook@example.net,8759738538,Vang-Johnson,Mental health nurse,Hong Kong,Your on writer doctor country tend business artist.
Hannah Suarez,taylor87@example.com,001-985-266-2721x6233,"Camacho, Li and Davis",Warden/ranger,Faroe Islands,Apply list door various form system rock long peace would economic by involve wife.
Mark Martin Jr.,robert46@example.org,,Evans-Fowler,"Presenter, broadcasting",Vietnam,Stand list couple raise myself miss begin drug work town right ago pattern might rather to.
Ricky Wong,jhughes@example.org,794.471.5103x129,Mcclure Group,"Designer, interior/spatial",Netherlands Antilles,Enter approach back and find make similar always live any education.
Jeffrey Barron,amy53@example.net,(340)574-1385x02420,Burke Ltd,Web designer,Samoa,Since its necessary yourself establish near statement deep memory serve administration first growth push move.
Sean Ford,ejoseph@example.net,(479)859-7987,"Horne, Ramirez and Alexander","Administrator, charities/voluntary organisations",New Caledonia,Believe enter per operation support pretty site environmental.
Kevin Hernandez,cantrellcory@example.org,646-809-4751x147,Johnson Ltd,Bookseller,Iran,Method politics former himself own plan police.
Dawn Ellis,kellylee@example.org,570-525-0454,Harris PLC,"Scientist, physiological",Tanzania,Leave everything chair since often growth machine himself save anything impact business.
Leah Green,coreybranchexample.org,001-630-570-6145x22390,Armstrong Ltd,Research scientist (medical),French Polynesia,Itself home community rule be network no individual so per well second cause.
Tony Wiggins,ohodges@example.com,(478)358-1148,"Acosta, Torres and Jones","Civil engineer, contracting",Sudan,What scene common girl when onto than increase stand close condition media bar want here.
Scott Hubbard,qgreen@example.org,001-295-570-6140x1560,Calderon-Livingston,Curator,Maldives,Treatment parent speech Congress major positive list lose bad animal interview property check.
Matthew Evans,brownphilip@example.com,001-514-622-6291x512,"Sosa, Mayer and Miller",Sports coach,Vanuatu,Safe her look prove condition cold current.
Amanda Frederick,ibaileyexample.net,+1-681-647-0552,"Ford, Turner and Bruce","Psychologist, counselling",Bouvet Island (Bouvetoya),Work treatment always indicate finally level paper.
John Garza,alexandernolan@example.net,406.713.5767x14076,Lee LLC,"Exhibitions officer, museum/gallery",India,Civil story TV million develop expect sea without learn in shake expect when available.
David Thompson,njones@example.com,203-399-9562x1694,Campos LLC,Architect,Argentina,Turn concern dream college stand less reality responsibility food successful.
Ronald Craig,jessicabarry@example.net,313-638-7587x2200,"Stout, Hoffman and Foster",Freight forwarder,Kuwait,Some story Republican instead American both his appear example argue same.
Mary Jacobson,doylesamuel@example.org,(355)627-5561,Lang Group,"Scientist, research (medical)",Lao People's Democratic Republic,Despite his effort before town ahead special.
Cindy Greene,teresa09@example.com,(525)234-7377,Miller-Acosta,Barista,Croatia,Improve stage left herself mean way fine two guess sister third.
Rose Nunez,ysmith@example.org,(791)228-3973x422,"Hunter, Nelson and Bentley",Civil Service administrator,Japan,Concern need Congress computer southern head risk chance feel type she leave mean product left.
Cristina Mclean,rickywilliams@example.org,001-708-774-6584x5207,Chambers-Davis,Psychiatric nurse,Andorra,Good cultural when few woman drop consider.
Joshua Johnson,boydrebecca@example.org,607.766.3172,Schneider-Ali,Forest/woodland manager,Kenya,Might executive wear positive represent left necessary fine answer.
Erin Ingram,williamsthomas@example.com,532-461-0076x036,Kim Inc,Electrical engineer,China,Similar civil nothing physical us lot degree.
Maria Martin,lindakingexample.net,672.796.4612,Lewis Group,Product/process development scientist,Guam,Least doctor notice manager civil two feel difference turn every eight song air wrong international.
veronica bailey,amanda03example.com,428-976-0229x54407,Rivera-Williams,"Teacher, English as a foreign language",Samoa,Address police source a wind spring western some letter but.
Cynthia Smith,vangbrenda@example.org,689.725.1753,"Lane, Strickland and Kelly",Historic buildings inspector/conservation officer,Isle of Man,Power report trouble return weight tough bad find sense kitchen head understand.
David Bonilla,traci24@example.com,404-821-2504x1102,Obrien-Conley,Medical laboratory scientific officer,Cayman Islands,More human ask push air house sometimes future other loss.
Tyler Schultz,mendozatammy@example.org,916-516-5411x743,"Bush, Lewis and Ford",Air cabin crew,Cook Islands,Recent evening before material employee color cause.
Elizabeth Smith,stephanieadams@example.org,733.376.4038x7276,Tucker-Castillo,"Nurse, mental health",Ecuador,Drop city sign million nor threat practice weight somebody good effort force action.
Sharon Mcpherson,hebertnancy@example.net,(227)440-6057,Tucker LLC,Operational investment banker,Pitcairn Islands,Local wide discuss believe enough leader wait bill.
Emily Williams,stephaniejohnson@example.com,(609)222-7054x79965,Ferguson Inc,Network engineer,San Marino,Report condition move participant prove maybe remember artist same certainly agreement special.
Brittany Thompson,zgallagher@example.com,4918746545,"Pacheco, Mcgee and Peterson",Art gallery manager,Romania,Land player walk commercial me low yard whom study yard.
